### ISSUE TITLE
icmp packet  every second to 1.1.1.1 ip

### ISSUE THREAD

**Issue by nessust** [exelban/stats#1096]
21:52:27.466881 IP one.one.one.one > 0.0.2.130: ICMP echo reply, id 44361, seq 0, length 24
21:52:30.410280 IP 0.0.2.130 > one.one.one.one: ICMP echo request, id 44361, seq 0, length 24
21:52:30.477144 IP one.one.one.one > 0.0.2.130: ICMP echo reply, id 44361, seq 0, length 24
21:52:33.411992 IP 0.0.2.130 > one.one.one.one: ICMP echo request, id 44361, seq 0, length 24
21:52:33.466719 IP one.one.one.one > 0.0.2.130: ICMP echo reply, id 44361, seq 0, length 24
21:52:36.410398 IP 0.0.2.130 > one.one.one.one: ICMP echo request, id 44361, seq 0, length 24
21:52:36.476255 IP one.one.one.one > 0.0.2.130: ICMP echo reply, id 44361, seq 0, length 24
